{
  "consumer_operation_id": "synthetic-publication-1",
  "status": "accepted",
  "schema_version": "propertyscope.property-sales.v1",
  "content_sha256": "aaaaaaaaaaaaaaaaaaaaaaaaaaaaaaaaaaaaaaaaaaaaaaaaaaaaaaaaaaaaaaaa",
  "rows_received": 1,
  "rows_accepted": 1,
  "rows_rejected": 0,
  "error": null
}
